Bank_Name,Category,State,District,City,Pincode
State Bank of India,Public,Maharashtra,Pune,Hadapsar,411028
HDFC Bank,Private,Maharashtra,Pune,Wagholi,412207
Kolhapur District Central Co-op Bank,Co-op,Maharashtra,Kolhapur,Kolhapur City,416012
Rajarshi Shahu Co-op Bank,Co-op,Maharashtra,Kolhapur,Ichalkaranji,416115
AU Small Finance Bank,SFB,Maharashtra,Nagpur,Kamptee,440013
"Janata Sahakari Bank, Pune",Co-op,Maharashtra,Pune,Shivajinagar,411005
Bank of Maharashtra,Public,Maharashtra,Chhatrapati Sambhajinagar,Paithan,431107
Saraswat Co-op Bank,Co-op,Maharashtra,Mumbai Suburban,Andheri,400053
